{
  "$schema": "https://flowconsole.tech/contracts/model-snapshot/v1/schema.json",
  "schemaVersion": "1.0.0",
  "source": "CodeScan",
  "elements": [
    {
      "id": "endpoint-1",
      "kind": "Endpoint",
      "name": "GET /api/orders",
      "properties": {
        "httpMethod": "GET"
      }
    }
  ],
  "relationships": []
}
