{
  "$schema": "https://flowconsole.tech/contracts/model-snapshot/v1/schema.json",
  "schemaVersion": "1.0.0",
  "source": "Git",
  "elements": [
    {
      "id": "order-service",
      "kind": "Service",
      "name": "Order Service",
      "description": "Handles order lifecycle",
      "technology": "Spring Boot",
      "canonicalId": "codescan:order-service",
      "tags": ["backend", "critical"],
      "properties": { "team": "orders", "tier": "1" }
    }
  ],
  "relationships": []
}
